{
  "schemaVersion": 1,
  "generatedAt": "2026-10-12T17:45:46+03:00",
  "currency": "EUR",
  "summary": {
    "invested": 12479.29,
    "currentValue": 13777.69,
    "profit": 1848.3,
    "returnRate": 14.8109,
    "xirr": 42.8101,
    "cash": 120.27,
    "incomeReceived": 682.0,
    "platformCount": 22,
    "activeInvestments": 194,
    "delayedInvestments": 37,
    "completedInvestments": 178
  },
  "allocation": [
    {
      "group": "brokerage",
      "name": "Brokeriai",
      "invested": 5169.34,
      "currentValue": 5543.11,
      "profit": 373.77,
      "cash": 2.71,
      "percentage": 40.2325,
      "platformCount": 2
    },
    {
      "group": "real_estate",
      "name": "NT sutelktinis finansavimas",
      "invested": 3673.21,
      "currentValue": 4188.19,
      "profit": 514.98,
      "cash": 73.23,
      "percentage": 30.3983,
      "platformCount": 4
    },
    {
      "group": "p2p",
      "name": "P2P",
      "invested": 3286.74,
      "currentValue": 3539.94,
      "profit": 339.94,
      "cash": 44.33,
      "percentage": 25.6933,
      "platformCount": 12
    },
    {
      "group": "funds",
      "name": "Fondai",
      "invested": 350.0,
      "currentValue": 506.45,
      "profit": 468.25,
      "cash": 0.0,
      "percentage": 3.6759,
      "platformCount": 2
    },
    {
      "group": "robo",
      "name": "Robo",
      "invested": 0.0,
      "currentValue": 0.0,
      "profit": 151.36,
      "cash": 0.0,
      "percentage": 0.0,
      "platformCount": 2
    }
  ],
  "platforms": [
    {
      "id": "seb-mikro",
      "slug": "seb-mikro",
      "name": "SEB Mikro",
      "group": "brokerage",
      "type": "brokerage",
      "category": "ETF portfelis",
      "currency": "EUR",
      "active": true,
      "startDate": "2024-05-01",
      "updatedAt": "2026-09-30",
      "website": "https://www.seb.lt",
      "sourceFile": "seb-mikro.json",
      "summary": {
        "invested": 3194.34,
        "currentValue": 3395.08,
        "profit": 200.74,
        "returnRate": 6.2842,
        "xirr": 17.5002,
        "cash": 0.0,
        "incomeReceived": 0.0,
        "activeInvestments": 5,
        "delayedInvestments": 0,
        "completedInvestments": 8,
        "averageRate": null,
        "averageLtv": null
      }
    },
    {
      "id": "revolut-brokerage",
      "slug": "revolut-brokerage",
      "name": "Revolut Brokerage",
      "group": "brokerage",
      "type": "brokerage",
      "category": "ETF ir akcijų portfelis",
      "currency": "EUR",
      "active": true,
      "startDate": "2024-12-01",
      "updatedAt": "2026-09-30",
      "website": "https://www.revolut.com",
      "sourceFile": "revolut-brokerage.json",
      "summary": {
        "invested": 1975.0,
        "currentValue": 2148.03,
        "profit": 173.03,
        "returnRate": 8.761,
        "xirr": 18.4611,
        "cash": 2.71,
        "incomeReceived": 12.47,
        "activeInvestments": 4,
        "delayedInvestments": 0,
        "completedInvestments": 9,
        "averageRate": null,
        "averageLtv": null
      }
    },
    {
      "id": "profitus",
      "slug": "profitus",
      "name": "Profitus",
      "group": "real_estate",
      "type": "real_estate",
      "category": "NT sutelktinis finansavimas",
      "currency": "EUR",
      "active": true,
      "startDate": "2025-02-17",
      "updatedAt": "2026-10-12",
      "website": "https://profitus.lt",
      "sourceFile": "profitus.json",
      "summary": {
        "invested": 1114.17,
        "currentValue": 1250.06,
        "profit": 135.89,
        "returnRate": 12.1965,
        "xirr": 9.6676,
        "cash": 50.72,
        "incomeReceived": 115.89,
        "activeInvestments": 10,
        "delayedInvestments": 1,
        "completedInvestments": 12,
        "averageRate": 8.7485,
        "averageLtv": 58.2667
      }
    },
    {
      "id": "crowdpear",
      "slug": "crowdpear",
      "name": "Crowdpear",
      "group": "real_estate",
      "type": "real_estate",
      "category": "NT sutelktinis finansavimas",
      "currency": "EUR",
      "active": true,
      "startDate": "2025-03-03",
      "updatedAt": "2026-10-12",
      "website": "https://crowdpear.com",
      "sourceFile": "crowdpear.json",
      "summary": {
        "invested": 1030.0,
        "currentValue": 1197.84,
        "profit": 167.84,
        "returnRate": 16.2951,
        "xirr": 12.0843,
        "cash": 6.01,
        "incomeReceived": 127.84,
        "activeInvestments": 8,
        "delayedInvestments": 4,
        "completedInvestments": 14,
        "averageRate": 9.6846,
        "averageLtv": 57.2402
      }
    },
    {
      "id": "scramble",
      "slug": "scramble",
      "name": "Scramble",
      "group": "p2p",
      "type": "p2p_loans",
      "category": "P2P verslo paskolos",
      "currency": "EUR",
      "active": true,
      "startDate": "2025-06-03",
      "updatedAt": "2026-10-31",
      "website": "https://scramble.investments",
      "sourceFile": "scramble.json",
      "summary": {
        "invested": 950.0,
        "currentValue": 1079.0,
        "profit": 129.0,
        "returnRate": 13.5789,
        "xirr": 15.113,
        "cash": 0.99,
        "incomeReceived": 129.0,
        "activeInvestments": 0,
        "delayedInvestments": 6,
        "completedInvestments": 10,
        "averageRate": 0.0,
        "averageLtv": null
      }
    },
    {
      "id": "nordstreet",
      "slug": "nordstreet",
      "name": "Nordstreet",
      "group": "real_estate",
      "type": "real_estate",
      "category": "NT sutelktinis finansavimas",
      "currency": "EUR",
      "active": true,
      "startDate": "2025-02-28",
      "updatedAt": "2026-10-12",
      "website": "https://nordstreet.com",
      "sourceFile": "nordstreet.json",
      "summary": {
        "invested": 854.83,
        "currentValue": 1033.7,
        "profit": 178.87,
        "returnRate": 20.9246,
        "xirr": 14.506,
        "cash": 9.91,
        "incomeReceived": 129.93,
        "activeInvestments": 4,
        "delayedInvestments": 14,
        "completedInvestments": 8,
        "averageRate": 12.2685,
        "averageLtv": 57.4773
      }
    },
    {
      "id": "rontgen",
      "slug": "rontgen",
      "name": "Rontgen",
      "group": "real_estate",
      "type": "real_estate",
      "category": "NT sutelktinis finansavimas",
      "currency": "EUR",
      "active": true,
      "startDate": "2025-11-03",
      "updatedAt": "2026-10-12",
      "website": "https://rontgen.lt",
      "sourceFile": "rontgen.json",
      "summary": {
        "invested": 674.21,
        "currentValue": 706.59,
        "profit": 32.38,
        "returnRate": 4.8027,
        "xirr": 5.9494,
        "cash": 6.59,
        "incomeReceived": 28.38,
        "activeInvestments": 7,
        "delayedInvestments": 0,
        "completedInvestments": 2,
        "averageRate": 7.0556,
        "averageLtv": 64.2222
      }
    },
    {
      "id": "indemo",
      "slug": "indemo",
      "name": "Indemo",
      "group": "p2p",
      "type": "indemo",
      "category": "Hipoteka užtikrintos paskolos",
      "currency": "EUR",
      "active": true,
      "startDate": "2025-03-21",
      "updatedAt": "2026-10-31",
      "website": "https://indemo.eu",
      "sourceFile": "indemo.json",
      "summary": {
        "invested": 636.74,
        "currentValue": 637.06,
        "profit": 87.06,
        "returnRate": 13.67,
        "xirr": 12.46,
        "cash": 0.32,
        "incomeReceived": 2.57,
        "activeInvestments": 80,
        "delayedInvestments": 0,
        "completedInvestments": 8,
        "averageRate": null,
        "averageLtv": 0.5797
      }
    },
    {
      "id": "synergy",
      "slug": "synergy",
      "name": "Synergy",
      "group": "funds",
      "type": "funds",
      "category": "Investiciniai fondai",
      "currency": "EUR",
      "active": true,
      "startDate": "2024-01-01",
      "updatedAt": null,
      "website": null,
      "sourceFile": "synergy.json",
      "summary": {
        "invested": 350.0,
        "currentValue": 506.45,
        "profit": 156.45,
        "returnRate": 44.7,
        "xirr": 18.61,
        "cash": 0.0,
        "incomeReceived": 0.0,
        "activeInvestments": 2,
        "delayedInvestments": 0,
        "completedInvestments": 0,
        "averageRate": null,
        "averageLtv": null
      }
    },
    {
      "id": "viainvest",
      "slug": "viainvest",
      "name": "Viainvest",
      "group": "p2p",
      "type": "p2p_loans",
      "category": "P2P vartojimo paskolos",
      "currency": "EUR",
      "active": true,
      "startDate": "2025-01-07",
      "updatedAt": "2026-10-31",
      "website": "https://viainvest.investments",
      "sourceFile": "viainvest.json",
      "summary": {
        "invested": 430.0,
        "currentValue": 454.74,
        "profit": 24.74,
        "returnRate": 5.7535,
        "xirr": 9.232,
        "cash": 35.93,
        "incomeReceived": 24.74,
        "activeInvestments": 9,
        "delayedInvestments": 2,
        "completedInvestments": 7,
        "averageRate": 10.6889,
        "averageLtv": null
      }
    },
    {
      "id": "nectaro",
      "slug": "nectaro",
      "name": "Nectaro",
      "group": "p2p",
      "type": "p2p_loans",
      "category": "P2P vartojimo paskolos",
      "currency": "EUR",
      "active": true,
      "startDate": "2025-09-09",
      "updatedAt": "2026-10-31",
      "website": "https://nectaro.investments",
      "sourceFile": "nectaro.json",
      "summary": {
        "invested": 320.0,
        "currentValue": 353.94,
        "profit": 33.94,
        "returnRate": 10.6062,
        "xirr": 12.5277,
        "cash": 1.07,
        "incomeReceived": 33.94,
        "activeInvestments": 24,
        "delayedInvestments": 0,
        "completedInvestments": 30,
        "averageRate": 12.1926,
        "averageLtv": null
      }
    },
    {
      "id": "debitum",
      "slug": "debitum",